<?xml version="1.0"?>
<!DOCTYPE HPCToolkitExperiment [
<!-- ******************************************************************** -->
<!-- HPCToolkit Experiment DTD						  -->
<!-- Version 2.0							  -->
<!-- ******************************************************************** -->
<!ELEMENT HPCToolkitExperiment (Header, (SecCallPathProfile|SecFlatProfile)*)>
<!ATTLIST HPCToolkitExperiment
	  version CDATA #REQUIRED>

  <!-- ****************************************************************** -->

  <!-- Info/NV: flexible name-value pairs: (n)ame; (t)ype; (v)alue -->
  <!ELEMENT Info (NV*)>
  <!ATTLIST Info
	    n CDATA #IMPLIED>
  <!ELEMENT NV EMPTY>
  <!ATTLIST NV
	    n CDATA #REQUIRED
	    t CDATA #IMPLIED
	    v CDATA #REQUIRED>

  <!-- ****************************************************************** -->
  <!-- Header								  -->
  <!-- ****************************************************************** -->
  <!ELEMENT Header (Info*)>
  <!ATTLIST Header
	    n CDATA #REQUIRED>

  <!-- ****************************************************************** -->
  <!-- Section Header							  -->
  <!-- ****************************************************************** -->
  <!ELEMENT SecHeader (MetricTable?, MetricDBTable?, TraceDBTable?, LoadModuleTable?, FileTable?, ProcedureTable?, Info*)>

    <!-- MetricTable: -->
    <!ELEMENT MetricTable (Metric)*>

    <!-- Metric: (i)d; (n)ame -->
    <!--   (v)alue-type: transient type of values -->
    <!--   (t)ype: persistent type of metric -->
    <!--   fmt: format; show; -->
    <!ELEMENT Metric (MetricFormula*, Info?)>
    <!ATTLIST Metric
	      i            CDATA #REQUIRED
	      n            CDATA #REQUIRED
	      v            (raw|final|derived-incr|derived) "raw"
	      t            (inclusive|exclusive|nil) "nil"
	      partner      CDATA #IMPLIED
	      fmt          CDATA #IMPLIED
	      show         (1|0) "1"
	      show-percent (1|0) "1">

    <!-- MetricFormula represents derived metrics: (t)ype; (frm): formula -->
    <!ELEMENT MetricFormula (Info?)>
    <!ATTLIST MetricFormula
	      t   (combine|finalize) "finalize"
	      i   CDATA #IMPLIED
	      frm CDATA #REQUIRED>

    <!-- Metric data, used in sections: (n)ame [from Metric]; (v)alue -->
    <!ELEMENT M EMPTY>
    <!ATTLIST M
	      n CDATA #REQUIRED
	      v CDATA #REQUIRED>

    <!-- MetricDBTable: -->
    <!ELEMENT MetricDBTable (MetricDB)*>

    <!-- MetricDB: (i)d; (n)ame -->
    <!--   db-glob:        file glob describing files in metric db -->
    <!--   db-id:          id within metric db -->
    <!--   db-num-metrics: number of metrics in db -->
    <!--   db-header-sz:   size (in bytes) of a db file header -->
    <!ELEMENT MetricDB EMPTY>
    <!ATTLIST MetricDB
	      i              CDATA #REQUIRED
	      n              CDATA #REQUIRED
	      db-glob        CDATA #IMPLIED
	      db-id          CDATA #IMPLIED
	      db-num-metrics CDATA #IMPLIED
	      db-header-sz   CDATA #IMPLIED>

    <!-- TraceDBTable: -->
    <!ELEMENT TraceDBTable (TraceDB)>

    <!-- TraceDB: (i)d -->
    <!--   db-min-time: min beginning time stamp (global) -->
    <!--   db-max-time: max ending time stamp (global) -->
    <!ELEMENT TraceDB EMPTY>
    <!ATTLIST TraceDB
	      i            CDATA #REQUIRED
	      db-glob      CDATA #IMPLIED
	      db-min-time  CDATA #IMPLIED
	      db-max-time  CDATA #IMPLIED
	      db-header-sz CDATA #IMPLIED>

    <!-- LoadModuleTable assigns a short name to a load module -->
    <!ELEMENT LoadModuleTable (LoadModule)*>

    <!ELEMENT LoadModule (Info?)>
    <!ATTLIST LoadModule
	      i CDATA #REQUIRED
	      n CDATA #REQUIRED>

    <!-- FileTable assigns a short name to a file -->
    <!ELEMENT FileTable (File)*>

    <!ELEMENT File (Info?)>
    <!ATTLIST File
	      i CDATA #REQUIRED
	      n CDATA #REQUIRED>

    <!-- ProcedureTable assigns a short name to a procedure -->
    <!ELEMENT ProcedureTable (Procedure)*>

    <!ELEMENT Procedure (Info?)>
    <!ATTLIST Procedure
	      i CDATA #REQUIRED
	      n CDATA #REQUIRED>

  <!-- ****************************************************************** -->
  <!-- Section: Call path profile					  -->
  <!-- ****************************************************************** -->
  <!ELEMENT SecCallPathProfile (SecHeader, SecCallPathProfileData)>
  <!ATTLIST SecCallPathProfile
	    i CDATA #REQUIRED
	    n CDATA #REQUIRED>

    <!ELEMENT SecCallPathProfileData (PF|M)*>
      <!-- Procedure frame -->
      <!--   (i)d: unique identifier for cross referencing -->
      <!--   (s)tatic scope id -->
      <!--   (n)ame: a string or an id in ProcedureTable -->
      <!--   (lm) load module: a string or an id in LoadModuleTable -->
      <!--   (f)ile name: a string or an id in LoadModuleTable -->
      <!--   (l)ine range: "beg-end" (inclusive range) -->
      <!--   (a)lien: whether frame is alien to enclosing P -->
      <!--   (v)ma-range-set: "{[beg-end), [beg-end)...}" -->
      <!ELEMENT PF (PF|Pr|L|C|S|M)*>
      <!ATTLIST PF
		i  CDATA #IMPLIED
		s  CDATA #IMPLIED
		n  CDATA #REQUIRED
		lm CDATA #IMPLIED
		f  CDATA #IMPLIED
		l  CDATA #IMPLIED
		v  CDATA #IMPLIED>
      <!-- Procedure (static): GOAL: replace with 'P' -->
      <!ELEMENT Pr (Pr|L|C|S|M)*>
      <!ATTLIST Pr
                i  CDATA #IMPLIED
		s  CDATA #IMPLIED
                n  CDATA #REQUIRED
		lm CDATA #IMPLIED
		f  CDATA #IMPLIED
                l  CDATA #IMPLIED
		a  (1|0) "0"
		v  CDATA #IMPLIED>
      <!-- Callsite (a special StatementRange) -->
      <!ELEMENT C (PF|M)*>
      <!ATTLIST C
		i CDATA #IMPLIED
		s CDATA #IMPLIED
		l CDATA #IMPLIED
		v CDATA #IMPLIED>

  <!-- ****************************************************************** -->
  <!-- Section: Flat profile						  -->
  <!-- ****************************************************************** -->
  <!ELEMENT SecFlatProfile (SecHeader, SecFlatProfileData)>
  <!ATTLIST SecFlatProfile
	    i CDATA #REQUIRED
	    n CDATA #REQUIRED>

    <!ELEMENT SecFlatProfileData (LM|M)*>
      <!-- Load module: (i)d; (n)ame; (v)ma-range-set -->
      <!ELEMENT LM (F|P|M)*>
      <!ATTLIST LM
                i CDATA #IMPLIED
                n CDATA #REQUIRED
		v CDATA #IMPLIED>
      <!-- File -->
      <!ELEMENT F (P|L|S|M)*>
      <!ATTLIST F
                i CDATA #IMPLIED
                n CDATA #REQUIRED>
      <!-- Procedure (Note 1) -->
      <!ELEMENT P (P|A|L|S|C|M)*>
      <!ATTLIST P
                i CDATA #IMPLIED
                n CDATA #REQUIRED
                l CDATA #IMPLIED
		v CDATA #IMPLIED>
      <!-- Alien (Note 1) -->
      <!ELEMENT A (A|L|S|C|M)*>
      <!ATTLIST A
                i CDATA #IMPLIED
                f CDATA #IMPLIED
                n CDATA #IMPLIED
                l CDATA #IMPLIED
		v CDATA #IMPLIED>
      <!-- Loop (Note 1,2) -->
      <!ELEMENT L (A|Pr|L|S|C|M)*>
      <!ATTLIST L
		i CDATA #IMPLIED
		s CDATA #IMPLIED
		l CDATA #IMPLIED
		v CDATA #IMPLIED>
      <!-- Statement (Note 2) -->
      <!--   (it): trace record identifier -->
      <!ELEMENT S (S|M)*>
      <!ATTLIST S
		i  CDATA #IMPLIED
		it CDATA #IMPLIED
		s  CDATA #IMPLIED
		l  CDATA #IMPLIED
		v  CDATA #IMPLIED>
      <!-- Note 1: Contained Cs may not contain PFs -->
      <!-- Note 2: The 's' attribute is not used for flat profiles -->
]>
<HPCToolkitExperiment version="2.0">
<Header n="cg.C.O3.64.bupc.infiniband">
  <Info/>
</Header>
<SecCallPathProfile i="0" n="cg.C.O3.64.bupc.infiniband">
<SecHeader>
  <MetricTable>
    <Metric i="2" n="WALLCLOCK (us):Sum (I)" v="derived-incr" t="inclusive" partner="3" show="1" show-percent="1">
      <MetricFormula t="combine" frm="sum($2, $2)"/>
      <MetricFormula t="finalize" frm="$2"/>
      <Info><NV n="units" v="events"/></Info>
    </Metric>
    <Metric i="3" n="WALLCLOCK (us):Sum (E)" v="derived-incr" t="exclusive" partner="2" show="1" show-percent="1">
      <MetricFormula t="combine" frm="sum($3, $3)"/>
      <MetricFormula t="finalize" frm="$3"/>
      <Info><NV n="units" v="events"/></Info>
    </Metric>
  </MetricTable>
  <MetricDBTable>
    <MetricDB i="0" n="WALLCLOCK (us) (I)" db-glob="*.metric-db" db-id="0" db-num-metrics="2" db-header-sz="24"/>
    <MetricDB i="1" n="WALLCLOCK (us) (E)" db-glob="*.metric-db" db-id="1" db-num-metrics="2" db-header-sz="24"/>
  </MetricDBTable>
  <TraceDBTable>
    <TraceDB i="0" db-glob="*.hpctrace" db-min-time="1339025630987515" db-max-time="1339025651088462" db-header-sz="24"/>
  </TraceDBTable>
  <LoadModuleTable>
    <LoadModule i="2" n="/dahome/la5/codes/npb-upc-2.4-11.02/bin.C.64/cg.C.O3.64"/>
    <LoadModule i="88415" n="~unknown-load-module~"/>
    <LoadModule i="88421" n="/dahome/la5/pkgs/hpctoolkit/lib/hpctoolkit/ext-libs/libmonitor.so.0.0.0"/>
    <LoadModule i="88431" n="/usr/lib64/libibverbs.so.1.0.0"/>
    <LoadModule i="88435" n="/lib64/libpthread-2.12.so"/>
    <LoadModule i="88439" n="/lib64/librt-2.12.so"/>
    <LoadModule i="88443" n="/opt/apps/openmpi/1.4.4-gcc/lib/libmpi.so.0.0.3"/>
    <LoadModule i="88603" n="/opt/apps/openmpi/1.4.4-gcc/lib/libopen-rte.so.0.0.0"/>
    <LoadModule i="88621" n="/opt/apps/openmpi/1.4.4-gcc/lib/libopen-pal.so.0.0.0"/>
    <LoadModule i="88663" n="/lib64/libc-2.12.so"/>
    <LoadModule i="88667" n="/lib64/ld-2.12.so"/>
    <LoadModule i="88671" n="/usr/lib64/libmlx4-m-rdmav2.so"/>
  </LoadModuleTable>
  <FileTable>
    <File i="843" n="./src/dahome/la5/app/bupc/dbg/include/gasnet_trace.h"/>
    <File i="880" n="./src/dahome/la5/app/bupc/dbg/include/ibv-conduit/gasnet_extended.h"/>
    <File i="4339" n="./src/dahome/la5/app/bupc/dbg/include/upcr_shaccess.h"/>
    <File i="6260" n="./src/dahome/la5/app/bupc/dbg/include/upcr_sptr.h"/>
    <File i="7109" n="./src/dahome/la5/codes/npb-upc-2.4-11.02/CG/variants/cg.O3.c"/>
    <File i="8086" n="./src/dahome/la5/codes/npb-upc-2.4-11.02/common/c_randdp.c"/>
    <File i="8123" n="./src/dahome/la5/codes/npb-upc-2.4-11.02/common/upc_timers.h"/>
    <File i="8209" n="./src/dahome/la5/pkgs-src/berkeley_upc-2.14.2/gasnet/extended-ref/gasnet_coll_autotune.c"/>
    <File i="10951" n="./src/dahome/la5/pkgs-src/berkeley_upc-2.14.2/gasnet/extended-ref/gasnet_coll_eager.c"/>
    <File i="12230" n="./src/dahome/la5/pkgs-src/berkeley_upc-2.14.2/gasnet/extended-ref/gasnet_coll_hashtable.c"/>
    <File i="12415" n="./src/dahome/la5/pkgs-src/berkeley_upc-2.14.2/gasnet/extended-ref/gasnet_coll_internal.h"/>
    <File i="18294" n="./src/dahome/la5/pkgs-src/berkeley_upc-2.14.2/gasnet/extended-ref/gasnet_coll_scratch.c"/>
    <File i="18739" n="./src/dahome/la5/pkgs-src/berkeley_upc-2.14.2/gasnet/extended-ref/gasnet_coll_team.c"/>
    <File i="18994" n="./src/dahome/la5/pkgs-src/berkeley_upc-2.14.2/gasnet/extended-ref/gasnet_coll_trees.c"/>
    <File i="33069" n="./src/dahome/la5/pkgs-src/berkeley_upc-2.14.2/gasnet/extended-ref/gasnet_extended_common.c"/>
    <File i="33379" n="./src/dahome/la5/pkgs-src/berkeley_upc-2.14.2/gasnet/extended-ref/gasnet_extended_refbarrier.c"/>
    <File i="34304" n="./src/dahome/la5/pkgs-src/berkeley_upc-2.14.2/gasnet/extended-ref/gasnet_extended_refcoll.c"/>
    <File i="40811" n="./src/dahome/la5/pkgs-src/berkeley_upc-2.14.2/gasnet/gasnet_atomic_bits.h"/>
    <File i="41006" n="./src/dahome/la5/pkgs-src/berkeley_upc-2.14.2/gasnet/gasnet_atomicops.h"/>
    <File i="42227" n="./src/dahome/la5/pkgs-src/berkeley_upc-2.14.2/gasnet/gasnet_coll.h"/>
    <File i="43830" n="./src/dahome/la5/pkgs-src/berkeley_upc-2.14.2/gasnet/gasnet_help.h"/>
    <File i="45119" n="./src/dahome/la5/pkgs-src/berkeley_upc-2.14.2/gasnet/gasnet_internal.c"/>
    <File i="46751" n="./src/dahome/la5/pkgs-src/berkeley_upc-2.14.2/gasnet/gasnet_membar.h"/>
    <File i="46764" n="./src/dahome/la5/pkgs-src/berkeley_upc-2.14.2/gasnet/gasnet_mmap.c"/>
    <File i="47821" n="./src/dahome/la5/pkgs-src/berkeley_upc-2.14.2/gasnet/gasnet_pshm.c"/>
    <File i="49066" n="./src/dahome/la5/pkgs-src/berkeley_upc-2.14.2/gasnet/gasnet_pshm.h"/>
    <File i="49369" n="./src/dahome/la5/pkgs-src/berkeley_upc-2.14.2/gasnet/gasnet_syncops.h"/>
    <File i="50953" n="./src/dahome/la5/pkgs-src/berkeley_upc-2.14.2/gasnet/gasnet_syncops.h"/>
    <File i="51961" n="./src/dahome/la5/pkgs-src/berkeley_upc-2.14.2/gasnet/gasnet_toolhelp.h"/>
    <File i="53901" n="./src/dahome/la5/pkgs-src/berkeley_upc-2.14.2/gasnet/gasnet_tools.c"/>
    <File i="55561" n="./src/dahome/la5/pkgs-src/berkeley_upc-2.14.2/gasnet/gasnet_trace.c"/>
    <File i="62863" n="./src/dahome/la5/pkgs-src/berkeley_upc-2.14.2/gasnet/other/firehose/firehose.c"/>
    <File i="64195" n="./src/dahome/la5/pkgs-src/berkeley_upc-2.14.2/gasnet/other/firehose/firehose_hash.c"/>
    <File i="64330" n="./src/dahome/la5/pkgs-src/berkeley_upc-2.14.2/gasnet/other/firehose/firehose_region.c"/>
    <File i="65754" n="./src/dahome/la5/pkgs-src/berkeley_upc-2.14.2/gasnet/other/mpi-spawner/gasnet_bootstrap_mpi.c"/>
    <File i="68519" n="./src/dahome/la5/pkgs-src/berkeley_upc-2.14.2/gasnet/vapi-conduit/gasnet_core.c"/>
    <File i="70713" n="./src/dahome/la5/pkgs-src/berkeley_upc-2.14.2/gasnet/vapi-conduit/gasnet_core.h"/>
    <File i="70788" n="./src/dahome/la5/pkgs-src/berkeley_upc-2.14.2/gasnet/vapi-conduit/gasnet_core_connect.c"/>
    <File i="72658" n="./src/dahome/la5/pkgs-src/berkeley_upc-2.14.2/gasnet/vapi-conduit/gasnet_core_sndrcv.c"/>
    <File i="75491" n="./src/dahome/la5/pkgs-src/berkeley_upc-2.14.2/gasnet/vapi-conduit/gasnet_core_sndrcv.c"/>
    <File i="75881" n="./src/dahome/la5/pkgs-src/berkeley_upc-2.14.2/gasnet/vapi-conduit/gasnet_extended.c"/>
    <File i="77669" n="./src/dahome/la5/pkgs-src/berkeley_upc-2.14.2/upcr_alloc.c"/>
    <File i="80483" n="./src/dahome/la5/pkgs-src/berkeley_upc-2.14.2/upcr_barrier.c"/>
    <File i="80508" n="./src/dahome/la5/pkgs-src/berkeley_upc-2.14.2/upcr_broadcast.c"/>
    <File i="80526" n="./src/dahome/la5/pkgs-src/berkeley_upc-2.14.2/upcr_coll_init.c"/>
    <File i="81064" n="./src/dahome/la5/pkgs-src/berkeley_upc-2.14.2/upcr_init.c"/>
    <File i="86948" n="./src/dahome/la5/pkgs-src/berkeley_upc-2.14.2/upcr_sptr.c"/>
    <File i="87245" n="./src/dahome/la5/pkgs-src/berkeley_upc-2.14.2/upcr_sptr.h"/>
    <File i="88045" n="./src/dahome/la5/pkgs-src/berkeley_upc-2.14.2/upcr_threads.c"/>
    <File i="88192" n="/tmp/upcc-la5-15223-1339023399/cg.O3.w2c.h"/>
    <File i="88216" n="/tmp/upcc-la5-15323-1339023401/cg.C.O3.64_startup_tmp.c"/>
    <File i="88333" n="./src/usr/include/infiniband/verbs.h"/>
    <File i="88390" n="~unknown-file~"/>
    <File i="88416" n="~unknown-file~"/>
    <File i="88422" n="/dahome/la5/svn/externals/libmonitor/work/src/../../libmonitor-0.x-r124/src/mpi_init_c.c"/>
    <File i="88425" n="/dahome/la5/svn/externals/libmonitor/work/src/../../libmonitor-0.x-r124/src/pthread.c"/>
    <File i="88428" n="/dahome/la5/svn/externals/libmonitor/work/src/../../libmonitor-0.x-r124/src/mpi_final_c.c"/>
    <File i="88432" n="~unknown-file~"/>
    <File i="88436" n="~unknown-file~"/>
    <File i="88440" n="~unknown-file~"/>
    <File i="88444" n="~unknown-file~"/>
    <File i="88447" n="topo_unity_component.c"/>
    <File i="88452" n="pml_ob1_component.c"/>
    <File i="88461" n="btl_openib_component.c"/>
    <File i="88472" n="mpool_rdma_module.c"/>
    <File i="88479" n="bml_r2.c"/>
    <File i="88488" n="btl_openib.c"/>
    <File i="88499" n="btl_sm_frag.c"/>
    <File i="88508" n="dpm_orte.c"/>
    <File i="88525" n="btl_openib_connect_oob.c"/>
    <File i="88574" n="btl_openib_frag.c"/>
    <File i="88593" n="ompi_free_list.c"/>
    <File i="88600" n="btl_openib_endpoint.c"/>
    <File i="88604" n="snapc_base_fns.c"/>
    <File i="88613" n="oob_tcp_peer.c"/>
    <File i="88618" n="rml_oob_recv.c"/>
    <File i="88622" n="timer_linux_component.c"/>
    <File i="88625" n="~unknown-file~"/>
    <File i="88640" n="ltdl.c"/>
    <File i="88649" n="poll.c"/>
    <File i="88658" n="malloc.c"/>
    <File i="88664" n="~unknown-file~"/>
    <File i="88668" n="~unknown-file~"/>
    <File i="88672" n="~unknown-file~"/>
  </FileTable>
  <ProcedureTable>
    <Procedure i="844" n="gasneti_trace_setsourceline"/>
    <Procedure i="1641" n="_gasnet_get_bulk"/>
    <Procedure i="4340" n="upcri_shared_nodeof"/>
    <Procedure i="4486" n="_upcr_put_pshared"/>
    <Procedure i="5920" n="_upcr_memget"/>
    <Procedure i="6295" n="upcr_threadof_pshared"/>
    <Procedure i="6417" n="_upcri_shared_to_remote"/>
    <Procedure i="6616" n="upcr_pshared_to_shared"/>
    <Procedure i="6778" n="upcr_add_psharedI"/>
    <Procedure i="6823" n="_upcr_add_pshared1"/>
    <Procedure i="7140" n="user_main"/>
    <Procedure i="7424" n="setup_submatrix_info"/>
    <Procedure i="7526" n="makea"/>
    <Procedure i="7597" n="sprnvc"/>
    <Procedure i="7635" n="icnvrt"/>
    <Procedure i="7644" n="vecset"/>
    <Procedure i="7665" n="sparse"/>
    <Procedure i="7738" n="conj_grad"/>
    <Procedure i="7952" n="reduce_sum"/>
    <Procedure i="7989" n="reduce_sum_2"/>
    <Procedure i="8087" n="randlc"/>
    <Procedure i="8124" n="UPC_Wtime"/>
    <Procedure i="8161" n="timer_start"/>
    <Procedure i="8178" n="timer_stop"/>
    <Procedure i="8230" n="fast_log2_32bit"/>
    <Procedure i="8238" n="gasnete_coll_autotune_get_num_tree_types"/>
    <Procedure i="8265" n="gasnete_coll_autotune_register_algorithm"/>
    <Procedure i="8314" n="gasnete_coll_register_broadcast_collectives"/>
    <Procedure i="8590" n="gasnete_coll_register_exchange_collectives"/>
    <Procedure i="8788" n="gasnete_coll_register_collectives"/>
    <Procedure i="8820" n="gasnete_coll_autotune_init"/>
    <Procedure i="11002" n="gasnete_coll_pf_bcast_TreeEager"/>
    <Procedure i="12231" n="gasnete_table_create"/>
    <Procedure i="12305" n="gasnete_hashtable_create"/>
    <Procedure i="12732" n="_gasnete_coll_get_threaddata"/>
    <Procedure i="18295" n="gasnete_coll_alloc_new_scratch_status"/>
    <Procedure i="18740" n="initialize_team_fields"/>
    <Procedure i="18822" n="gasnete_coll_team_init"/>
    <Procedure i="19817" n="gasnete_coll_build_dissemination"/>
    <Procedure i="19867" n="gasnete_coll_fetch_dissemination"/>
    <Procedure i="33133" n="gasnete_init_threaddata"/>
    <Procedure i="33247" n="gasnete_new_threaddata"/>
    <Procedure i="33380" n="gasnete_barrier_pf_enable"/>
    <Procedure i="33397" n="gasnete_pshmbarrier_notify_inner"/>
    <Procedure i="33455" n="finish_pshm_barrier"/>
    <Procedure i="33463" n="gasnete_pshmbarrier_wait_inner"/>
    <Procedure i="33485" n="gasnete_pshmbarrier_try_inner"/>
    <Procedure i="33627" n="gasnete_amdbarrier_notify_reqh"/>
    <Procedure i="33657" n="gasnete_amdbarrier_kick"/>
    <Procedure i="33718" n="gasnete_amdbarrier_notify"/>
    <Procedure i="33755" n="gasnete_amdbarrier_wait"/>
    <Procedure i="33850" n="gasnete_amdbarrier_kick_team_all"/>
    <Procedure i="34148" n="gasnete_coll_barrier_notify_internal"/>
    <Procedure i="34167" n="gasnete_coll_barrier_wait_internal"/>
    <Procedure i="34190" n="gasnet_barrier_notify"/>
    <Procedure i="34206" n="gasnet_barrier_wait"/>
    <Procedure i="34425" n="gasnete_coll_try_sync"/>
    <Procedure i="34515" n="gasnete_coll_sync_saved_handles"/>
    <Procedure i="34788" n="gasnete_coll_poll"/>
    <Procedure i="34849" n="gasnete_coll_auxseg_alloc"/>
    <Procedure i="34868" n="gasnete_coll_init"/>
    <Procedure i="35785" n="gasnete_coll_broadcast"/>
    <Procedure i="35792" n="_gasnet_coll_broadcast"/>
    <Procedure i="36338" n="gasnete_coll_broadcast_nb_default"/>
    <Procedure i="40812" n="_gasneti_atomic32_increment"/>
    <Procedure i="40820" n="_gasneti_atomic32_decrement_and_test"/>
    <Procedure i="40825" n="_gasneti_atomic32_compare_and_swap"/>
    <Procedure i="40830" n="gasneti_atomic32_fetchadd"/>
    <Procedure i="41275" n="gasneti_atomic64_read"/>
    <Procedure i="41543" n="gasneti_atomic_read"/>
    <Procedure i="41737" n="gasneti_atomic_decrement_and_test"/>
    <Procedure i="41811" n="gasneti_atomic_compare_and_swap"/>
    <Procedure i="41885" n="gasneti_atomic_add"/>
    <Procedure i="42623" n="gasnete_coll_wait_sync"/>
    <Procedure i="44735" n="gasneti_AMPoll"/>
    <Procedure i="45069" n="gasnet_getenv"/>
    <Procedure i="45134" n="gasneti_checkinit"/>
    <Procedure i="45140" n="gasneti_checkattach"/>
    <Procedure i="45343" n="gasneti_setupGlobalEnvironment"/>
    <Procedure i="45971" n="gasneti_memalloc_envinit"/>
    <Procedure i="46059" n="_gasneti_memcheck_one"/>
    <Procedure i="46156" n="_gasneti_memcheck"/>
    <Procedure i="46238" n="_gasneti_malloc_inner"/>
    <Procedure i="46338" n="_gasneti_malloc"/>
    <Procedure i="46348" n="_gasneti_free"/>
    <Procedure i="46411" n="_gasneti_calloc"/>
    <Procedure i="46752" n="gasneti_local_wmb"/>
    <Procedure i="46756" n="_gasneti_local_rmb"/>
    <Procedure i="46765" n="gasneti_mmap_internal"/>
    <Procedure i="46800" n="gasneti_mmap"/>
    <Procedure i="46873" n="gasneti_pshm_mmap"/>
    <Procedure i="46960" n="gasneti_mmap_shared_internal"/>
    <Procedure i="47002" n="gasneti_mmap_remote_shared"/>
    <Procedure i="47015" n="gasneti_mmap_shared"/>
    <Procedure i="47020" n="gasneti_mmap_vnet"/>
    <Procedure i="47048" n="gasneti_munmap"/>
    <Procedure i="47124" n="_gasneti_mmap_segment_search_inner"/>
    <Procedure i="47199" n="gasneti_mmapLimit"/>
    <Procedure i="47287" n="gasneti_segmentInit"/>
    <Procedure i="47388" n="gasneti_segmentAttachLocal"/>
    <Procedure i="47451" n="gasneti_AttachRemote"/>
    <Procedure i="47522" n="gasneti_segmentAttach"/>
    <Procedure i="47700" n="gasneti_auxseg_init"/>
    <Procedure i="47822" n="gasneti_pshm_init"/>
    <Procedure i="48293" n="gasneti_pshmnet_bootstrapBarrier"/>
    <Procedure i="48412" n="gasneti_pshmnet_bootstrapBroadcast"/>
    <Procedure i="48753" n="gasneti_AMPSHMPoll"/>
    <Procedure i="49073" n="gasneti_pshm_in_supernode"/>
    <Procedure i="49545" n="_gasneti_semaphore_read"/>
    <Procedure i="49570" n="_gasneti_semaphore_up"/>
    <Procedure i="49637" n="_gasneti_semaphore_trydown"/>
    <Procedure i="50090" n="gasneti_semaphore_up"/>
    <Procedure i="50243" n="gasneti_semaphore_trydown"/>
    <Procedure i="50858" n="_gasneti_lifo_push"/>
    <Procedure i="50953" n="_gasneti_lifo_push"/>
    <Procedure i="51424" n="gasneti_lifo_push"/>
    <Procedure i="51962" n="gasneti_count0s_uint32_t"/>
    <Procedure i="51987" n="gasneti_mutex_trylock"/>
    <Procedure i="54859" n="gasneti_getenv"/>
    <Procedure i="55004" n="_gasneti_getenv_withdefault"/>
    <Procedure i="55050" n="gasneti_getenv_yesno_withdefault"/>
    <Procedure i="55056" n="gasneti_getenv_int_withdefault"/>
    <Procedure i="55268" n="gasneti_count0s_xform1"/>
    <Procedure i="55285" n="gasneti_count0s_nzs_aligned_region"/>
    <Procedure i="55421" n="gasneti_count0s"/>
    <Procedure i="56340" n="gasneti_trace_init"/>
    <Procedure i="62864" n="firehose_init"/>
    <Procedure i="62934" n="firehose_fini"/>
    <Procedure i="63037" n="firehose_try_local_pin"/>
    <Procedure i="63249" n="firehose_try_remote_pin"/>
    <Procedure i="63395" n="firehose_release"/>
    <Procedure i="63472" n="fh_request_new"/>
    <Procedure i="63572" n="fh_priv_acquire_local"/>
    <Procedure i="63632" n="fh_priv_acquire_remote"/>
    <Procedure i="63679" n="fh_priv_release_local"/>
    <Procedure i="63736" n="fh_priv_release_remote"/>
    <Procedure i="64196" n="inthash"/>
    <Procedure i="64207" n="fh_hash_create"/>
    <Procedure i="64220" n="fh_hash_destroy"/>
    <Procedure i="64227" n="fh_hash_find"/>
    <Procedure i="64264" n="fh_hash_apply"/>
    <Procedure i="64345" n="fh_priv_end"/>
    <Procedure i="64409" n="fh_bucket_lookup"/>
    <Procedure i="64944" n="fh_region_ispinned"/>
    <Procedure i="65073" n="fh_commit_try_local_region"/>
    <Procedure i="65104" n="fh_release_local_region"/>
    <Procedure i="65294" n="fh_commit_try_remote_region"/>
    <Procedure i="65322" n="fh_release_remote_region"/>
    <Procedure i="65403" n="fh_init_plugin"/>
    <Procedure i="65658" n="fh_fini_plugin"/>
    <Procedure i="65755" n="gasneti_bootstrapInit_mpi"/>
    <Procedure i="65799" n="gasneti_bootstrapFini_mpi"/>
    <Procedure i="65817" n="gasneti_bootstrapBarrier_mpi"/>
    <Procedure i="65825" n="gasneti_bootstrapExchange_mpi"/>
    <Procedure i="65833" n="gasneti_bootstrapAlltoall_mpi"/>
    <Procedure i="65841" n="gasneti_bootstrapBroadcast_mpi"/>
    <Procedure i="68562" n="gasneti_bootstrapBarrier"/>
    <Procedure i="68645" n="gasneti_bootstrapExchange"/>
    <Procedure i="68705" n="gasnetc_unpin"/>
    <Procedure i="68717" n="gasnetc_pin"/>
    <Procedure i="68738" n="gasnetc_try_pin_inner"/>
    <Procedure i="68759" n="gasnetc_trypin"/>
    <Procedure i="68776" n="gasnetc_init_pin_info"/>
    <Procedure i="68834" n="gasnetc_load_settings"/>
    <Procedure i="69122" n="gasneti_bootstrapInit"/>
    <Procedure i="69458" n="gasnetc_init"/>
    <Procedure i="69639" n="gasnet_init_GASNET_SEQpshmLARGEdebugtracestatsdebugmallocsrclines"/>
    <Procedure i="69689" n="gasnetc_attach"/>
    <Procedure i="70140" n="gasnetc_exit_body"/>
    <Procedure i="70325" n="gasnetc_exit_init"/>
    <Procedure i="70343" n="gasnetc_exit"/>
    <Procedure i="70370" n="gasnetc_AMRequestShortM"/>
    <Procedure i="70631" n="gasnetc_hsl_lock"/>
    <Procedure i="70669" n="gasnetc_hsl_unlock"/>
    <Procedure i="70714" n="gasnetc_counter_wait"/>
    <Procedure i="71095" n="gasnetc_qp_create"/>
    <Procedure i="71163" n="gasnetc_qp_reset2init"/>
    <Procedure i="71199" n="gasnetc_qp_init2rtr"/>
    <Procedure i="71241" n="gasnetc_qp_rtr2rts"/>
    <Procedure i="72260" n="gasnetc_connect_static"/>
    <Procedure i="72428" n="gasnetc_connect_init"/>
    <Procedure i="72717" n="gasnetc_my_perthread"/>
    <Procedure i="72783" n="gasnetc_sr_desc_init"/>
    <Procedure i="72792" n="gasnetc_rcv_post"/>
    <Procedure i="72856" n="gasnetc_amrdma_grant"/>
    <Procedure i="72897" n="gasnetc_amrdma_eligable"/>
    <Procedure i="72948" n="gasnetc_processPacket"/>
    <Procedure i="73214" n="gasnetc_snd_reap"/>
    <Procedure i="73409" n="gasnetc_get_cep"/>
    <Procedure i="73433" n="gasnetc_bind_cep_inner"/>
    <Procedure i="73475" n="gasnetc_ack"/>
    <Procedure i="73484" n="gasnetc_hidden_ack"/>
    <Procedure i="73500" n="gasnetc_rcv_am"/>
    <Procedure i="73590" n="gasnetc_rcv_reap"/>
    <Procedure i="73626" n="gasnetc_amrdma_zeros"/>
    <Procedure i="73632" n="gasnetc_rcv_amrdma"/>
    <Procedure i="73761" n="gasnetc_poll_rcv_hca"/>
    <Procedure i="73788" n="gasnetc_do_poll"/>
    <Procedure i="73802" n="gasnetc_get_sreq"/>
    <Procedure i="73884" n="gasnetc_snd_validate"/>
    <Procedure i="73975" n="gasnetc_snd_post_common"/>
    <Procedure i="74066" n="gasnetc_get_amrdma_slot"/>
    <Procedure i="74093" n="gasnetc_encode_amrdma"/>
    <Procedure i="74120" n="gasnetc_ReqRepGeneric"/>
    <Procedure i="74472" n="gasnetc_fh_post"/>
    <Procedure i="74596" n="gasnetc_fh_do_get"/>
    <Procedure i="74617" n="gasnetc_get_local_fh"/>
    <Procedure i="74742" n="gasnetc_fh_get_helper"/>
    <Procedure i="74781" n="gasnetc_sndrcv_limits"/>
    <Procedure i="74939" n="gasnetc_sndrcv_init"/>
    <Procedure i="75405" n="gasnetc_sndrcv_poll"/>
    <Procedure i="75410" n="gasnetc_counter_wait_aux"/>
    <Procedure i="75478" n="gasnetc_rdma_get"/>
    <Procedure i="75491" n="gasnetc_rdma_get"/>
    <Procedure i="75527" n="gasnetc_RequestGeneric"/>
    <Procedure i="75545" n="gasnetc_ReplyGeneric"/>
    <Procedure i="75601" n="gasnetc_ReplySysShort"/>
    <Procedure i="75664" n="gasnetc_AMPoll"/>
    <Procedure i="75996" n="gasnete_iop_new"/>
    <Procedure i="76416" n="gasnete_init"/>
    <Procedure i="76769" n="gasnete_get_bulk"/>
    <Procedure i="77808" n="upcri_init_heaps"/>
    <Procedure i="80484" n="_upcr_notify"/>
    <Procedure i="80490" n="_upcr_wait"/>
    <Procedure i="80513" n="_upcri_broadcast"/>
    <Procedure i="80527" n="upcri_coll_init"/>
    <Procedure i="81175" n="upcri_startup_messages"/>
    <Procedure i="81251" n="upcr_startup_init"/>
    <Procedure i="81294" n="upcr_startup_attach"/>
    <Procedure i="81487" n="upcri_perthread_spawn"/>
    <Procedure i="81590" n="upcr_startup_spawn"/>
    <Procedure i="81618" n="upcri_finalbarrier"/>
    <Procedure i="81702" n="upcr_global_exit"/>
    <Procedure i="81724" n="upcri_do_exit"/>
    <Procedure i="81757" n="do_bupc_init_reentrant"/>
    <Procedure i="81789" n="bupc_init_reentrant"/>
    <Procedure i="81835" n="_upcri_bzero_mythreads_pshareof"/>
    <Procedure i="81895" n="_upcr_startup_pshalloc"/>
    <Procedure i="87075" n="upcri_check_addr_overflow"/>
    <Procedure i="87081" n="_upcri_check_addr_bounds"/>
    <Procedure i="87130" n="_upcri_checkvalid_shared"/>
    <Procedure i="87174" n="_upcri_checkvalid_pshared"/>
    <Procedure i="87280" n="upcr_threadof_pshared"/>
    <Procedure i="87296" n="upcr_addrfield_pshared"/>
    <Procedure i="88046" n="upcri_stack_check"/>
    <Procedure i="88193" n="UPCRI_ALLOC_cg_O3_3157593398"/>
    <Procedure i="88217" n="perfile_allocs"/>
    <Procedure i="88225" n="static_init"/>
    <Procedure i="88288" n="main"/>
    <Procedure i="88341" n="ibv_poll_cq"/>
    <Procedure i="88359" n="ibv_post_send"/>
    <Procedure i="88365" n="ibv_post_recv"/>
    <Procedure i="88391" n=".plt"/>
    <Procedure i="88419" n="~unknown-proc~"/>
    <Procedure i="88423" n="MPI_Init"/>
    <Procedure i="88426" n="pthread_create"/>
    <Procedure i="88429" n="MPI_Finalize"/>
    <Procedure i="88433" n="~unknown-proc~"/>
    <Procedure i="88437" n="~unknown-proc~"/>
    <Procedure i="88441" n="~unknown-proc~"/>
    <Procedure i="88445" n="PMPI_Init"/>
    <Procedure i="88450" n="mca_pml_base_select"/>
    <Procedure i="88455" n="mca_bml_base_init"/>
    <Procedure i="88459" n="mca_btl_base_select"/>
    <Procedure i="88468" n="ompi_free_list_grow"/>
    <Procedure i="88497" n="ompi_free_list_resize"/>
    <Procedure i="88502" n="mca_bml_base_btl_array_reserve"/>
    <Procedure i="88504" n="ompi_pubsub_base_open"/>
    <Procedure i="88506" n="ompi_dpm_base_open"/>